record_kind	page_index	block_index	line_index	next_page_index	next_block_index	next_line_index	label	notes
block	1	0	0				footer_header_noise	repeated report header should stay noise
block	1	1	1				paragraph	first page body should stay paragraph
block	1	2	2				footer_header_noise	repeated footer shell should stay noise
block	2	0	0				footer_header_noise	repeated report header should stay noise
block	2	1	1				paragraph	second page body should stay paragraph
block	2	2	2				footer_header_noise	repeated footer shell should stay noise
